{
  "$schema": "http://json-schema.org/draft-07/schema#",
  "$id": "https://github.com/enisaeu/CNW/tree/main/eukev/schemas/v1",
  "title": "EU KEV schema",
  "type": "array",
  "items": {
    "type": "object",
    "properties": {
      "cveID": {
        "type": "string",
        "description": "CVE ID of the vulnerability.",
        "pattern": "^CVE-20\\d{2}-\\d{4,}$"
      },
      "euvdID": {
        "type": "string",
        "description": "EUVD ID of the vulnerability.",
        "pattern": "^EUVD-20\\d{2}-\\d{4,}$"
      },
      "vendorProject": {
        "type": "string",
        "description": "Vendor or project name for the vulnerability."
      },
      "product": {
        "type": "string",
        "description": "The vulnerable product."
      },
      "vulnerabilityName": {
        "type": "string",
        "description": "Name of the vulnerability."
      },
      "dateReported": {
        "type": "string",
        "description": "Date the vulnerability exploitation was initially reported.",
        "pattern": "^20\\d{2}/([0][1-9]|[1][0-2])/([0][1-9]|[1-2][0-9]|[3][0-1])$"
      },
      "dateAdded": {
        "type": "string",
        "description": "Date the vulnerability was added to the catalog.",
        "pattern": "^20\\d{2}/([0][1-9]|[1][0-2])/([0][1-9]|[1-2][0-9]|[3][0-1])$"
      },
      "patchedSince": {
        "type": "string",
        "description": "Date the vulnerability was patched.",
        "pattern": "^20\\d{2}/([0][1-9]|[1][0-2])/([0][1-9]|[1-2][0-9]|[3][0-1])$"
      },
      "originSource": {
        "type": "string",
        "description": "Name of specific CNW member initially monitoring the vulnerability exploitation; CNW if monitored by multiple CNW members / in case of undisclosed reporting; EUI for EU institutions; CRA for mandatory reporting according to Cyber Resilience Act; ENISA for ENISA CTI."
      },
      "shortDescription": {
        "type": "string",
        "description": "Short description of the vulnerability."
      },
      "exploitationType": {
        "type": "array",
        "description": "Ransomware if known to have been used by a ransomware group; APT if known to have been used by an unspecific state-nexus groups; unknown if the reporting party lacks confirmation that the vulnerability has been utilized by a specific entity.",
        "items": {
          "type": "string",
          "enum": [
            "ransomware",
            "APT",
            "cybercrime",
            "unknown"
          ]
        }
      },
      "threatActorsExploiting": {
        "type": "array",
        "description": "Threat Actors known for exploiting the vulnerability.",
        "items": {
          "type": "string"
        }
      },
      "cwes": {
        "type": "array",
        "description": "Common Weakness Enumeration (CWE) codes associated with this vulnerability.",
        "items": {
          "pattern": "^CWE-\\d{2,}$", 
          "type": "string"
        }
      },
      "notes": {
        "type": "string",
        "description": "Additional notes related to the vulnerability listing."
      }
    },
    "required": ["cveID", "euvdID", "vendorProject", "product", "dateReported", "originSource", "shortDescription", "exploitationType"],
    "additionalProperties": false
  }
}
