[
  { 
    "cveID": "CVE-2026-86950", 
    "euvdID": "EUVD-2026-88445", 
    "vendorProject": "Apple", 
    "product": "macOS, iOS and iPadOS", 
    "dateReported": "2026/10/08",
    "patchedSince": "2026/09/28",
    "originSource": "CSIRT-IE", 
    "shortDescription": "An out-of-bounds write issue was addressed with improved bounds checking. This issue is fixed in iOS 26.7.1 and iPadOS 26.7.1, macOS Sequoia 15.8.1, macOS Tahoe 26.7.1. Processing a maliciously crafted file may lead to arbitrary code execution. Apple is aware of a report that this issue may have been exploited in an extremely sophisticated attack against specific targeted individuals on versions of iOS before iOS 27.", 
    "exploitationType": ["unknown"],
    "cwes": ["CWE-787"], 
    "notes": "https://support.apple.com/en-us/149226" 
  },
  { 
    "cveID": "CVE-2026-32202", 
    "euvdID": "EUVD-2026-22589", 
    "vendorProject": "Microsoft", 
    "product": "Windows 10, Windows 11, Windows Server", 
    "dateReported": "2026/10/07",
    "patchedSince": "2026/04/14",
    "originSource": "CNW", 
    "shortDescription": "CVE-2026-32202 is a Windows Shell protection mechanism failure that allows a crafted shortcut file to trigger automatic NTLM authentication to an attacker-controlled server, exposing the victim’s authentication data when its containing folder is viewed.", 
    "exploitationType": ["unknown"],
    "cwes": ["CWE-693"], 
    "notes": "https://msrc.microsoft.com/update-guide/vulnerability/CVE-2026-32202" 
  },
  { 
    "cveID": "CVE-2026-85103", 
    "euvdID": "EUVD-2026-75010", 
    "vendorProject": "Check Point", 
    "product": "Quantum Security Gateway, Quantum Security Management", 
    "dateReported": "2026/09/25",
    "patchedSince": "2026/09/07",
    "originSource": "CNW", 
    "shortDescription": "CVE-2026-85103 is a heap-based buffer overflow in ASN.1 certificate decoding that may allow an unauthenticated remote attacker to execute arbitrary code on Check Point Quantum Security Gateway and Security Management systems.", 
    "exploitationType": ["unknown"],
    "cwes": ["CWE-122"], 
    "notes": "https://support.checkpoint.com/results/sk/sk1000118" 
  },
  { 
    "cveID": "CVE-2026-88779", 
    "euvdID": "EUVD-2026-92065", 
    "vendorProject": "Citrix", 
    "product": "Citrix NetScaler ADC, Citrix NetScaler Gateway", 
    "dateReported": "2026/10/02",
    "patchedSince": "2026/10/04",
    "originSource": "CNW", 
    "shortDescription": "Memory overflow vulnerability leading to Denial of Service.", 
    "exploitationType": ["unknown"],
    "cwes": ["CWE-119"], 
    "notes": "https://support.citrix.com/support-home/kbsearch/article?articleNumber=CTX697174" 
  },
  { 
    "cveID": "CVE-2026-104286", 
    "euvdID": "EUVD-2026-91042", 
    "vendorProject": "Fortinet", 
    "product": "FortiMail", 
    "dateReported": "2026/10/01", 
    "originSource": "CNW", 
    "shortDescription": "Improper limitation of a pathname to a restricted directory ('path traversal') vulnerability in Fortinet FortiMail may allow an unauthenticated attacker to write arbitrary files on the underlying system via crafted HTTP or HTTPS requests. Customers are urged to disable the IBE feature support or disable access to the FortiMail management interface from the internet or limit the access only from trusted private network.", 
    "exploitationType": ["unknown"],
    "cwes": ["CWE-22","CWE-158"], 
    "notes": "https://fortiguard.fortinet.com/psirt/FG-IR-26-175" 
  },
  { 
    "cveID": "CVE-2026-82329", 
    "euvdID": "EUVD-2026-67861", 
    "vendorProject": "JFrog", 
    "product": "Artifactory", 
    "dateReported": "2026/10/01", 
    "patchedSince": "2026/08/28",
    "originSource": "ENISA", 
    "shortDescription": "Authentication weakness that, under default configuration, may allow an unauthenticated attacker with network access to obtain administrative privileges.", 
    "exploitationType": ["unknown"],
    "cwes": ["CWE-287"], 
    "notes": "https://www.wiz.io/blog/artifactory-under-attack-in-the-wild-exploitation-of-cve-2026-42016-cve-2026-4201" 
  },
  { 
    "cveID": "CVE-2026-102489", 
    "euvdID": "EUVD-2026-90080", 
    "vendorProject": "Zammad", 
    "product": "Zammad", 
    "dateReported": "2026/09/30", 
    "patchedSince": "2026/04/08",
    "originSource": "NCSC-NL", 
    "shortDescription": "Zammad versions 6.3.0 to 6.5.4 are vulnerable a session hijack vulnerability that leads to remote code execution as the zammad user. The vulnerability is also present in version 7.0.0 to version 7.1.3, but not exploitable due to environment conditions.", 
    "exploitationType": ["unknown"], 
    "notes": "https://www.ncsc.nl/alerts/actief-misbruik-van-zeroday-kwetsbaarheden-in-zammad-update-nu" 
  },
  { 
    "cveID": "CVE-2026-102490", 
    "euvdID": "EUVD-2026-90081", 
    "vendorProject": "Zammad", 
    "product": "Zammad", 
    "dateReported": "2026/09/30", 
    "originSource": "NCSC-NL", 
    "shortDescription": "All versions of Zammad including the latest alpha enable the local zammad user to escalate privileges to root.", 
    "exploitationType": ["unknown"], 
    "notes": "https://www.ncsc.nl/alerts/actief-misbruik-van-zeroday-kwetsbaarheden-in-zammad-update-nu" 
  },
  { 
    "cveID": "CVE-2026-88771", 
    "euvdID": "EUVD-2026-56431", 
    "vendorProject": "Citrix", 
    "product": "NetScaler ADC, NetScaler Gateway", 
    "dateReported": "2026/09/27", 
    "originSource": "CNW", 
    "shortDescription": "A remote code execution vulnerability exists due to improper input validation, which can allow an unauthenticated attacker to execute arbitrary commands", 
    "exploitationType": ["unknown"], 
    "cwes": ["CWE-20"], 
    "notes": "https://support.citrix.com/support-home/kbsearch/article?articleNumber=CTX697096" 
  },
  { 
    "cveID": "CVE-2026-88772", 
    "euvdID": "EUVD-2026-56431", 
    "vendorProject": "Citrix", 
    "product": "NetScaler ADC, NetScaler Gateway", 
    "dateReported": "2026/09/27", 
    "originSource": "CNW", 
    "shortDescription": "Memory overflow vulnerability leading to Remote Code Execution or Denial of Service", 
    "exploitationType": ["unknown"], 
    "cwes": ["CWE-119"], 
    "notes": "https://support.citrix.com/support-home/kbsearch/article?articleNumber=CTX697096" 
  },
  { 
    "cveID": "CVE-2026-65660", 
    "euvdID": "EUVD-2026-56431", 
    "vendorProject": "Microsoft", 
    "product": "Microsoft SharePoint Server 2019, Microsoft SharePoint Enterprise Server 2016, Microsoft SharePoint Server Subscription Edition", 
    "dateReported": "2026/09/25", 
    "originSource": "CSIRT-IE", 
    "shortDescription": "Improper control of generation of code ('code injection') in Microsoft Office SharePoint allows an authorized attacker to execute code over a user network", 
    "exploitationType": ["unknown"], 
    "cwes": ["CWE-94"], 
    "notes": "https://msrc.microsoft.com/update-guide/vulnerability/CVE-2026-65660" 
  }, 
  {
    "cveID": "CVE-2026-93952",
    "euvdID": "EUVD-2026-84296",
    "vendorProject": "Arista Networks",
    "product": "VeloCloud Orchestrator (VCO) On-Prem",
    "dateReported": "2026/09/22",
    "originSource": "CSIRT-IE",
    "shortDescription": "A security issue that may allow a remote attacker to access privileged internal functionality and impact the VCO host.",
    "exploitationType": ["unknown"],
    "cwes": ["CWE-20"],
    "notes": "https://www.arista.com/en/support/advisories-notices/security-advisory/24765-security-advisory-0183"
  },
  {
    "cveID": "CVE-2026-67279",
    "euvdID": "EUVD-2026-72027",
    "vendorProject": "MikroTik",
    "product": "RouterOS",
    "vulnerabilityName": "MikroTrick",
    "dateReported": "2026/09/27",
    "patchedSince": "2026/09/03",
    "originSource": "CERT.PL",
    "shortDescription": "RouterOS SSH enters the connection protocol after a client-requested rekey even though user authentication was never attempted, allowing an unauthenticated client to open a session channel and send an exec request. On affected builds the server dispatches the command, enabling unauthenticated creation, overwrite, and reconstruction of files in the RouterOS managed file namespace, including support files containing configuration and diagnostic data.This issue was fixed in versions: 6.49.21 (Long-term), 7.23.4 (Long-term) and 7.24.2 (Stable)",
    "exploitationType": ["unknown"],
    "cwes": ["CWE-841"],
    "notes": "https://cert.pl/en/posts/2026/09/vulnerabilities-in-mikrotik-routeros-actively-exploited/"
  },
  {
    "cveID": "CVE-2026-87902",
    "euvdID": "EUVD-2026-84555",
    "vendorProject": "WordPress Foundation",
    "product": "WordPress",
    "dateReported": "2026/09/23",
    "patchedSince": "2026/09/22",
    "originSource": "NCSC-NL",
    "shortDescription": "The vulnerabilitycan be exploited by an attacker without login credentials to have a special file loaded outside the normal themes of WordPress. Active abuse has been observed.",
    "exploitationType": ["unknown"],
    "cwes": ["CWE-98"],
    "notes": "https://www.ncsc.nl/alerts/kwetsbaarheid-in-wordpress-wordt-actief-misbruikt-update-nu"
  },
  {
    "cveID": "CVE-2026-94127",
    "euvdID": "EUVD-2026-84427",
    "vendorProject": "F5",
    "product": "BIG-IP",
    "dateReported": "2026/09/22",
    "originSource": "ENISA",
    "shortDescription": "Unauthenticated RCE vulnerability present when BIG-IP APM is configured as an OAuth Authorization Server.",
    "exploitationType": ["unknown"],
    "cwes": ["CWE-122"],
    "notes": "https://my.f5.com/manage/s/article/K000162605"
  },
  {
    "cveID": "CVE-2026-93616",
    "euvdID": "EUVD-2026-84375",
    "vendorProject": "checkpoint",
    "product": "Quantum Security Gateway",
    "dateReported": "2026/09/22",
    "patchedSince": "2026/09/09",
    "originSource": "ENISA",